<?xml version="1.0" encoding="UTF-8"?> 
<biblioteca xmlns:xsi="http://www.w3.org/2001/XMLSchema-instance"
		xsi:noNamespaceSchemaLocation="Ej4.xsd">
	<libro>
		<autor>Miguel de Cervantes Saavedra</autor>
		<titulo>El Quijote de la Mancha</titulo>
		<codigo>123</codigo>
    </libro>
 	<libro>
  		<autor>Pablo Neruda</autor>
  		<titulo>Veinte poemas de amor y una canciÃ³n desesperada</titulo>
  		<codigo>124</codigo>
 	</libro>
</biblioteca>